{
  "$schema": "../schema/product.v2.schema.json",
  "product_id": "hdfc-bank/pl",
  "partner_id": "hdfc-bank",
  "family": "PL",
  "product_name_official": "HDFC Bank XPRESS Personal Loan",
  "product_summary": "Instant Personal Loan up to ₹50 L starting at 9.99% p.a. for salaried individuals at private/public companies and PSUs. Disbursal in 10 seconds for pre-approved customers. Multiple use-case sub-products.",
  "scraped_at": "2026-04-27",
  "review_status": "pending",
  "review_notes": "Migrated from v1 placeholder; data backfilled via Playwright batch 6. Note: HDFC technically offers PL Balance Transfer (₹6,500 flat PF), but StatPro does NOT broker BT for unsecured loans per business rule — BT variant deliberately omitted from this record.",

  "base": {
    "borrower_classes": ["RETAIL_INDIVIDUAL_SALARIED"],
    "loan_facility_types": ["TERM_LOAN"],

    "pricing": {
      "roi": {
        "state": "RANGE_KNOWN",
        "min_pct": 9.99,
        "max_pct": 24.0,
        "basis": "Calculator range; advertised 'starting at 9.99%'",
        "is_risk_priced": true,
        "as_of_date": "2026-04-27"
      },
      "processing_fee": null,
      "default_interest_pct_pa": null,
      "other_charges_notes": "Zero foreclosure charges advertised."
    },

    "loan_structure": {
      "ltv_pct_max": null,
      "tenure_months_min": 12,
      "tenure_months_max": 84,
      "ticket_inr_min": 25000,
      "ticket_inr_max": 5000000
    },

    "eligibility": {
      "borrower_classes": ["RETAIL_INDIVIDUAL_SALARIED"],
      "entity_types": ["Salaried"],
      "individual": {
        "min_age_at_application": 21,
        "max_age_at_application": 60,
        "min_monthly_income_salaried_inr": 25000,
        "min_total_work_experience_months": 24,
        "min_current_employer_tenure_months": 12,
        "eligible_employer_categories": ["MNC", "PUBLIC_LTD", "LARGE_PVT", "GOVT_CENTRAL", "GOVT_STATE", "PSU"]
      },
      "business": null,
      "co_applicant": { "required": false },
      "geographies": ["India"]
    },

    "collateral_accepted": [],

    "documents_required": {
      "kyc": ["PAN", "Aadhaar / Voter ID / Passport / Driving License"],
      "income_salaried": ["Salary slips", "Bank statements", "Form 16"],
      "income_self_employed": [],
      "property": [],
      "business_kyc": [],
      "other": []
    },

    "claimed_turnaround": {
      "preapproved_customer_disbursal_seconds": 10,
      "disbursal_days_max": 4
    },

    "delivery_channels": ["BRANCH", "DIGITAL_SELF_SERVE", "MOBILE_APP", "WHATSAPP"],
    "assessment_methods": ["BANK_STATEMENT_BASED"],

    "key_features": [
      "Loans from ₹25K to ₹50 L",
      "Disbursal in 10 seconds for pre-approved HDFC customers",
      "ROI starting at 9.99% p.a.",
      "Zero foreclosure charges",
      "Personal Accident Cover (₹8 L) + Critical Illness (₹1 L) — optional add-on",
      "Multiple use-case sub-products: Wedding, Medical, Travel, Renovation, Education, etc."
    ],
    "fees_table_raw": null,
    "bundled_insurance_note": "HDFC Sarv Suraksha Pro (Credit Shield + Accidental Hospitalisation + Accidental Death/PD). HDFC Ergo GIC product. Out of StatPro scope — informational only."
  },

  "variants": [
    {
      "code": "FRESH",
      "label": "XPRESS Personal Loan (base)",
      "source_url": "https://www.hdfc.bank.in/personal-loan"
    },
    {
      "code": "INSTANT",
      "label": "Instant Personal Loan (10-second disbursal for pre-approved)"
    },
    {
      "code": "TEACHER",
      "label": "Personal Loan for Teachers",
      "audience_tags": ["TEACHER"]
    },
    {
      "code": "GOVT_EMPLOYEE",
      "label": "Personal Loan for Government Employees",
      "audience_tags": ["GOVT_EMPLOYEE"]
    },
    {
      "code": "WOMEN",
      "label": "Personal Loan for Women",
      "audience_tags": ["WOMEN"]
    },
    {
      "code": "WEDDING",
      "label": "Personal Loan for Wedding"
    },
    {
      "code": "MEDICAL",
      "label": "Personal Loan for Medical Needs"
    },
    {
      "code": "RENOVATION",
      "label": "Personal Loan for Home Renovation"
    },
    {
      "code": "OTHER",
      "label": "Education Loan",
      "variant_label_freetext": "Personal Loan for Education — HDFC categorises this under PL rather than education-specific underwriting"
    }
  ],

  "scheme_overlays": [],
  "regulatory_disclosures": ["FLOATING_RATE_RESET_OPTIONS"],

  "source_map": {
    "base.pricing":         "https://www.hdfc.bank.in/personal-loan",
    "base.eligibility":     "https://www.hdfc.bank.in/personal-loan",
    "base.loan_structure":  "https://www.hdfc.bank.in/personal-loan"
  },

  "data_quality": {
    "completeness_pct": 0.78,
    "fields_missing": ["pricing.processing_fee", "fees_table_raw"],
    "needs_retry_for": []
  }
}
